{
  "case_id": "synthetic-slow-setup",
  "failure_code": "slow-first-boot",
  "probe_mode": "direct",
  "platform": "windows",
  "setup_elapsed_seconds": 215,
  "setup_stage": "ready",
  "signature_phase": "agent-dependency-install",
  "signature_input_hashes": [
    "45403098388a2231a424dd291448329d337d2fd7b18b83f8832de64f24416d69",
    "3b5df8fc67049911781bcd2689afff18ca5959c2c2965847a8a81638c0a8edd4"
  ],
  "source": {
    "present": true
  },
  "launcher": {
    "present": true,
    "executable": true
  },
  "python": {
    "version": "3.11.9"
  },
  "health": {
    "status": "ok",
    "http_status": 200
  },
  "chat": {
    "method": "POST",
    "path": "/chat",
    "request_field": "user_input",
    "http_status": 200,
    "response_keys": [
      "agent_logs",
      "response",
      "session_id"
    ]
  },
  "installers": {
    "docs_mirrors_match": true
  },
  "repository": {
    "direct_main_change_requested": false
  },
  "safety": {
    "external_network_observed": false,
    "grail_modified": false
  },
  "environment": {
    "architecture": "x86_64",
    "certificate_state": "system-store-observed",
    "clock_state": "monotonic-and-wall-clock-observed",
    "filesystem": "ntfs",
    "locale": "en-us",
    "managed_policy": "managed-restricted",
    "os_build": "windows-11-23h2",
    "proxy_state": "not-observed",
    "security_product_state": "present-vendor-undisclosed",
    "shell": "powershell-7"
  },
  "bindings": {
    "ring": "stable-main",
    "installer_release_frame_version": "rapp-roadside-installer-frame/1.0",
    "installer_release_frame_sha256": "b9c23cbd73beb9fba9ee3e04c9f5073d1c86a1be23ee55c9b5ae4121ba794d19",
    "ring_manifest_sha256": "63ffba818af5a9423a5522f6c752f57dd638d7794d044d07376ad65bcd584b51",
    "source_commit": "0000000000000000000000000000000000000000",
    "source_tree_sha256": "cd9b416ebb24fbc274b00b3b58b23e29618d71480343b52fda96f2012908242a",
    "dependency_lock_sha256": "d82764a06aafcba6a91aceac3a626686df3b64ca636b07cc728792d891020602",
    "catalog_sha256": "cd580436958c4b2d56068a6541382d508c972987c765420fbc5ae3a787899fb3",
    "installer_sha256s": {
      "install.cmd": "4066d161da3adcee4c0963094bc937448d45589a0b864bfe0cd3b124a06f5ba3",
      "install.ps1": "17514fcc407397cfa7434fa6e9095fcdbc89be66ddc9652f1de003f4dec70b3b",
      "install.sh": "6ecf06f6dbbab6a920b5b208bc7c4069ca266b150d6c00533a00b5975a8417ca"
    },
    "unreported_fields": []
  },
  "reporting_ai": {
    "text_present": true,
    "text_sha256": "7f3df404b84e5422597617abb6956f2b549e4160ee02394ff38fc46db2306ea1",
    "text_bytes": 79,
    "log_count": 1,
    "log_sha256s": [
      "d31308e5265407118933b53bea94b09290a51bbdb49b131ea436fbff480e62ad"
    ],
    "instruction_markers_detected": false,
    "observed_claim_ids": [
      "health-ok",
      "chat-envelope"
    ],
    "inferred_claim_ids": [
      "setup-proven"
    ]
  },
  "attachments": [
    {
      "name": "setup-summary.json",
      "media_type": "application/json",
      "sha256": "18cc911cd3da43e17088c6962256a71fdc28fba9af01a0b91a0d71285e804001",
      "bytes": 81
    }
  ],
  "replay": {
    "argv": [
      "python3",
      "scripts/local_probe.py",
      "--wait-seconds",
      "120",
      "--check-chat",
      "--allow-loopback"
    ],
    "logical_cwd": "<rapp-root>",
    "input_sha256": "8db3a465115ee4e9af949ed1148ef937e48657d09bc83e28f2476e74ebdcbd05",
    "before_state_sha256": "2c4a0a94aa1539cd7688f0f36cbdf50d6481d135f152c282e3a0ca308a657873",
    "phase": "exact-local-retest",
    "duration_ms": 120000,
    "output_sha256": "03034d9afee949f967c873044c56beb92dcce9b65cbb033c654bf0fcd8a2e863",
    "output_bytes": 95
  },
  "transport": {
    "report_id": "8db3a465115ee4e9af949ed1148ef937e48657d09bc83e28f2476e74ebdcbd05",
    "created_epoch": 1788226197,
    "received_epoch": 1788226197,
    "ttl_seconds": 86400,
    "source_cell_id": "roadside-windows-synthetic",
    "source_verified": true,
    "frame_verified": true,
    "trust_weight_bps": 8000,
    "dedupe_count": 0,
    "rate_window_seconds": 3600,
    "rate_count": 2,
    "rate_limit": 3,
    "correlation_id": null,
    "correlation_disclosed": true
  },
  "cell": {
    "cell_id": "roadside-windows-synthetic",
    "shard_key_sha256": "ac4eba24708afa85dabce3f3bf9354eac5d7fac705a36fa5843b44df264d7484",
    "queue_depth": 2,
    "backpressure_threshold": 8,
    "max_queue_depth": 32,
    "local_raw_retention_seconds": 0,
    "global_raw_data_store": false,
    "global_lock": false,
    "global_exchange": "verified-signatures-frames-aggregate-evidence-only",
    "hot_cache_hits": 1,
    "negative_cache_hits": 1,
    "fairness_lane": "rare",
    "marginal_information_gain_bps": 10000
  }
}
