{
  "case_id": "linux-launcher-mode",
  "platform": "linux",
  "setup_elapsed_seconds": 12,
  "setup_stage": "starting-server",
  "source": {
    "present": true
  },
  "launcher": {
    "present": true,
    "executable": false
  },
  "python": {
    "version": "3.11.8"
  },
  "health": {
    "status": "unreachable",
    "http_status": null
  },
  "chat": {
    "method": "POST",
    "path": "/chat",
    "request_field": "user_input",
    "http_status": null,
    "response_keys": []
  },
  "installers": {
    "docs_mirrors_match": true
  },
  "repository": {
    "direct_main_change_requested": false
  },
  "safety": {
    "external_network_observed": false,
    "grail_modified": false
  }
}
